{
  "$comment": "GENERATED by contracts/codegen/generate.py from calibration.schema.yaml - DO NOT EDIT.",
  "$schema": "https://json-schema.org/draft/2020-12/schema",
  "additionalProperties": true,
  "description": "An optional scoped calibration entity (scope none|fleet|per_camera) \u2014 CONTRACT \u00a73.1, C-11.",
  "properties": {
    "calibration_id": {
      "description": "The calibration identity (the anchor; referenced nullably from the episode).",
      "minLength": 1,
      "type": "string"
    },
    "camera_serial": {
      "description": "The camera this resolves through (null for none/fleet; the physical identity, C-11).",
      "type": [
        "string",
        "null"
      ]
    },
    "captured_at": {
      "description": "When the calibration was captured.",
      "type": [
        "string",
        "null"
      ]
    },
    "distortion_coeffs": {
      "description": "Distortion coefficients (scalar array; lightweight queryable, OQ-B).",
      "items": {
        "type": "number"
      },
      "type": "array"
    },
    "effective_from": {
      "description": "Start of validity (OQ-6 as-of range).",
      "type": [
        "string",
        "null"
      ]
    },
    "effective_to": {
      "description": "End of validity; null = current (OQ-6).",
      "type": [
        "string",
        "null"
      ]
    },
    "intrinsics": {
      "description": "OPAQUE heavy-data blob (fx/fy/cx/cy/stitch params) \u2014 consumed Hermes-side, not queried (OQ-B).",
      "type": [
        "object",
        "null"
      ]
    },
    "method": {
      "description": "Calibration method/provenance.",
      "type": [
        "string",
        "null"
      ]
    },
    "schema": {
      "description": "Schema identifier; additive semver (\u00a75).",
      "enum": [
        "eunomia-calibration/v1"
      ],
      "type": "string"
    },
    "scope": {
      "description": "Which calibration world we're in (domain-closed hard enum, C-11). Data, not structure.",
      "enum": [
        "none",
        "fleet",
        "per_camera"
      ],
      "type": "string"
    }
  },
  "required": [
    "schema",
    "calibration_id",
    "scope"
  ],
  "title": "Calibration",
  "type": "object"
}
